{
  "$schema": "https://erdesigns.eu/schema/j1939-spn.json",
  "schema_version": 1,
  "description": "SAE J1939-71 Suspect Parameter Number (SPN) seed catalogue. Covers the most common engine / aftertreatment SPNs encountered in DM1 / DM2 / DM6 broadcasts. Hosts overlay full vendor sets via TOBDOEMCatalog at runtime.",
  "kind": "j1939-spn",
  "source": "SAE J1939-71:2024 Appendix B (subset)",
  "entries": [
    { "spn": 51,   "name": "Engine Throttle Position",
                   "unit": "%", "category": "engine" },
    { "spn": 84,   "name": "Wheel-Based Vehicle Speed",
                   "unit": "km/h", "category": "vehicle" },
    { "spn": 91,   "name": "Accelerator Pedal Position 1",
                   "unit": "%", "category": "engine" },
    { "spn": 92,   "name": "Engine Percent Load At Current Speed",
                   "unit": "%", "category": "engine" },
    { "spn": 94,   "name": "Engine Fuel Delivery Pressure",
                   "unit": "kPa", "category": "engine" },
    { "spn": 96,   "name": "Fuel Level 1",
                   "unit": "%", "category": "vehicle" },
    { "spn": 100,  "name": "Engine Oil Pressure",
                   "unit": "kPa", "category": "engine" },
    { "spn": 102,  "name": "Engine Intake Manifold #1 Pressure",
                   "unit": "kPa", "category": "engine" },
    { "spn": 105,  "name": "Engine Intake Manifold 1 Temperature",
                   "unit": "°C", "category": "engine" },
    { "spn": 108,  "name": "Barometric Pressure",
                   "unit": "kPa", "category": "ambient" },
    { "spn": 110,  "name": "Engine Coolant Temperature",
                   "unit": "°C", "category": "engine" },
    { "spn": 132,  "name": "Engine Mass Air Flow Rate",
                   "unit": "kg/h", "category": "engine" },
    { "spn": 158,  "name": "Battery Potential / Power Input 1",
                   "unit": "V", "category": "electrical" },
    { "spn": 175,  "name": "Engine Oil Temperature 1",
                   "unit": "°C", "category": "engine" },
    { "spn": 190,  "name": "Engine Speed",
                   "unit": "rpm", "category": "engine" },
    { "spn": 411,  "name": "Engine Exhaust Gas Recirculation 1 Differential Pressure",
                   "unit": "kPa", "category": "emissions" },
    { "spn": 412,  "name": "Engine EGR 1 Temperature",
                   "unit": "°C", "category": "emissions" },
    { "spn": 441,  "name": "Auxiliary Temperature 1",
                   "unit": "°C", "category": "engine" },
    { "spn": 524,  "name": "Selected Gear",
                   "unit": "gear", "category": "transmission" },
    { "spn": 627,  "name": "Charging System Indicator",
                   "unit": "bit", "category": "electrical" },
    { "spn": 639,  "name": "J1939 Network 1",
                   "unit": "—", "category": "network" },
    { "spn": 651,  "name": "Engine Injector Cylinder #1",
                   "unit": "—", "category": "engine" },
    { "spn": 729,  "name": "Engine Glow Plug Lamp",
                   "unit": "bit", "category": "engine" },
    { "spn": 1136, "name": "Engine ECU Temperature",
                   "unit": "°C", "category": "engine" },
    { "spn": 1209, "name": "Engine Exhaust Pressure 1",
                   "unit": "kPa", "category": "emissions" },
    { "spn": 1213, "name": "Malfunction Indicator Lamp",
                   "unit": "bit", "category": "diagnostics" },
    { "spn": 1761, "name": "Aftertreatment 1 Diesel Exhaust Fluid Tank Volume",
                   "unit": "%", "category": "aftertreatment" },
    { "spn": 2630, "name": "Engine Charge Air Cooler Outlet Temperature",
                   "unit": "°C", "category": "engine" },
    { "spn": 3216, "name": "Aftertreatment 1 Intake NOx",
                   "unit": "ppm", "category": "aftertreatment" },
    { "spn": 3217, "name": "Aftertreatment 1 Intake O2",
                   "unit": "%", "category": "aftertreatment" },
    { "spn": 3226, "name": "Aftertreatment 1 Outlet NOx",
                   "unit": "ppm", "category": "aftertreatment" },
    { "spn": 3242, "name": "Aftertreatment 1 DPF Intake Temperature",
                   "unit": "°C", "category": "aftertreatment" },
    { "spn": 3246, "name": "Aftertreatment 1 DPF Outlet Temperature",
                   "unit": "°C", "category": "aftertreatment" },
    { "spn": 3251, "name": "Aftertreatment 1 DPF Differential Pressure",
                   "unit": "kPa", "category": "aftertreatment" },
    { "spn": 3464, "name": "Engine Throttle Actuator 1 Control Command",
                   "unit": "%", "category": "engine" },
    { "spn": 3719, "name": "Aftertreatment 1 DPF Soot Load Percent",
                   "unit": "%", "category": "aftertreatment" },
    { "spn": 4364, "name": "Aftertreatment 1 SCR Conversion Efficiency",
                   "unit": "%", "category": "aftertreatment" },
    { "spn": 5018, "name": "Aftertreatment 1 SCR Catalyst Reagent Pressure",
                   "unit": "kPa", "category": "aftertreatment" }
  ]
}
